Product Number,Title,Revision Date,Posted Date,PDF Link
Form 8308,Report of a Sale or Exchange of Certain Partnership Interests,Oct 2024,10/30/2024,https://www.irs.gov/pub/irs-pdf/f8308.pdf
Instruction 8308,"Instructions for Form 8308, Report of a Sale or Exchange of Certain Partnership Interests",Nov 2025,12/22/2025,https://www.irs.gov/pub/irs-pdf/i8308.pdf
Form 8316,"Information Regarding Request for Refund of Social Security Tax Erroneously Withheld on Wages Received by a Nonresident Alien on an F, J, or M Type Visa",Jan 2006,07/17/2012,https://www.irs.gov/pub/irs-pdf/f8316.pdf
Form 8328,Carryforward Election of Unused Private Activity Bond Volume Cap,Aug 2022,09/01/2022,https://www.irs.gov/pub/irs-pdf/f8328.pdf
Form 8329,Lender's Information Return for Mortgage Credit Certificates (MCCs),Oct 2012,10/22/2012,https://www.irs.gov/pub/irs-pdf/f8329.pdf
Form 8330,Issuer's Quarterly Information Return for Mortgage Credit Certificates (MCCs),Oct 2021,10/15/2021,https://www.irs.gov/pub/irs-pdf/f8330.pdf
Form 8332,Release/Revocation of Release of Claim to Exemption for Child by Custodial Parent,Oct 2018,10/16/2018,https://www.irs.gov/pub/irs-pdf/f8332.pdf
Form 8379,Injured Spouse Allocation,Nov 2023,09/19/2024,https://www.irs.gov/pub/irs-pdf/f8379.pdf
Instruction 8379,"Instructions for Form 8379, Injured Spouse Allocation",Nov 2024,11/27/2024,https://www.irs.gov/pub/irs-pdf/i8379.pdf
Form 8396,Mortgage Interest Credit,2025,12/17/2025,https://www.irs.gov/pub/irs-pdf/f8396.pdf
Form 8404,Interest Charge on DISC-Related Deferred Tax Liability,2024,12/17/2024,https://www.irs.gov/pub/irs-pdf/f8404.pdf
Form 8453,U.S. Individual Income Tax Transmittal for an IRS e-file Return,2025,10/16/2025,https://www.irs.gov/pub/irs-pdf/f8453.pdf
Form 8453-CORP,E-file Declaration for Corporations,Dec 2025,11/20/2025,https://www.irs.gov/pub/irs-pdf/f8453crp.pdf
Form 8453-EG,E-file Declaration for Forms 709 and 709-NA,Dec 2024,02/27/2025,https://www.irs.gov/pub/irs-pdf/f8453eg.pdf
Form 8453-EMP,Employment Tax Declaration for an IRS e-file Return,Dec 2024,12/11/2024,https://www.irs.gov/pub/irs-pdf/f8453emp.pdf
Form 8453-EX,Excise Tax Declaration for an IRS e-file Return,Dec 2011,07/17/2012,https://www.irs.gov/pub/irs-pdf/f8453ex.pdf
Form 8453-FE,U.S. Estate or Trust Declaration for an IRS e-file Return,2024,01/15/2025,https://www.irs.gov/pub/irs-pdf/f8453fe.pdf
Form 8453-PE,E-file Declaration for Form 1065,2024,11/04/2024,https://www.irs.gov/pub/irs-pdf/f8453pe.pdf
Form 8453-R,Electronic Filing Declaration for Form 8963,Jan 2020,01/28/2020,https://www.irs.gov/pub/irs-pdf/f8453r.pdf
Form 8453-S,U.S. S Corporation Income Tax Declaration for an IRS e-file Return,2021,01/11/2022,https://www.irs.gov/pub/irs-pdf/f8453s.pdf
Form 8453 (sp),U.S. Individual Income Tax Declaration for an IRS e-file Return (Spanish Version),2025,10/16/2025,https://www.irs.gov/pub/irs-pdf/f8453sp.pdf
Form 8453-TE,Tax Exempt Entity Declaration and Signature for E-file,2025,12/09/2025,https://www.irs.gov/pub/irs-pdf/f8453te.pdf
Form 8453-WH,Electronic Filing Declaration for Form 1042,Dec 2022,01/06/2023,https://www.irs.gov/pub/irs-pdf/f8453wh.pdf
Form 8453-X,Political Organization Declaration for Electronic Filing of Notice of Section 527 Status,Aug 2019,09/10/2019,https://www.irs.gov/pub/irs-pdf/f8453x.pdf
Form 8498,Continuing Education Provider Application and Request for Provider Number,Sep 2023,08/31/2023,https://www.irs.gov/pub/irs-pdf/f8498.pdf
Form 8508,Application for a Waiver from Electronic Filing of Information Returns,Nov 2023,11/21/2023,https://www.irs.gov/pub/irs-pdf/f8508.pdf
Form 8508-I,Request for Waiver From Filing Information Returns Electronically,Nov 2015,03/31/2016,https://www.irs.gov/pub/irs-pdf/f8508i.pdf
Form 8546,Claim for Reimbursement of Bank Charges,Nov 2024,12/04/2024,https://www.irs.gov/pub/irs-pdf/f8546.pdf
Form 8554,Application for Renewal of Enrollment to Practice Before the Internal Revenue Service,Nov 2022,11/04/2022,https://www.irs.gov/pub/irs-pdf/f8554.pdf
Form 8554-EP,Application for Renewal of Enrollment to Practice Before the Internal Revenue Service as an Enrolled Retirement Plan Agent (ERPA),Nov 2022,11/04/2022,https://www.irs.gov/pub/irs-pdf/f8554ep.pdf
Form 8582,Passive Activity Loss Limitations,2025,12/01/2025,https://www.irs.gov/pub/irs-pdf/f8582.pdf
Instruction 8582,"Instructions for Form 8582, Passive Activity Loss Limitations",2025,12/04/2025,https://www.irs.gov/pub/irs-pdf/i8582.pdf
Form 8582-CR,Passive Activity Credit Limitations,Dec 2024,11/18/2024,https://www.irs.gov/pub/irs-pdf/f8582cr.pdf
Instruction 8582-CR,"Instructions for Form 8582-CR, Passive Activity Credit Limitations",Dec 2024,12/16/2024,https://www.irs.gov/pub/irs-pdf/i8582cr.pdf
Form 8586,Low-Income Housing Credit,Dec 2023,12/07/2023,https://www.irs.gov/pub/irs-pdf/f8586.pdf
Form 8594,Asset Acquisition Statement Under Section 1060,Nov 2021,11/19/2021,https://www.irs.gov/pub/irs-pdf/f8594.pdf
Instruction 8594,"Instructions for Form 8594, Asset Acquisition Statement Under Section 1060",Nov 2021,11/19/2021,https://www.irs.gov/pub/irs-pdf/i8594.pdf
Form 8596,Information Return for Federal Contracts,Jan 2024,11/17/2023,https://www.irs.gov/pub/irs-pdf/f8596.pdf
Form 8596-A,Quarterly Transmittal of Information Returns for Federal Contracts,Aug 2013,08/22/2013,https://www.irs.gov/pub/irs-pdf/f8596a.pdf
Form 8606,Nondeductible IRAs,2025,12/12/2025,https://www.irs.gov/pub/irs-pdf/f8606.pdf
Instruction 8606,"Instructions for Form 8606, Nondeductible IRAs",2025,12/16/2025,https://www.irs.gov/pub/irs-pdf/i8606.pdf
Form 8609,Low-Income Housing Credit Allocation and Certification,Dec 2021,12/29/2021,https://www.irs.gov/pub/irs-pdf/f8609.pdf
Instruction 8609,"Instructions for Form 8609, Low-Income Housing Credit Allocation and Certification",Dec 2025,12/11/2025,https://www.irs.gov/pub/irs-pdf/i8609.pdf
Form 8609-A,Annual Statement for Low-Income Housing Credit,Dec 2008,07/17/2012,https://www.irs.gov/pub/irs-pdf/f8609a.pdf
Instruction 8609-A,"Instructions for Form 8609-A, Annual Statement for Low-Income Housing Credit",Dec 2025,12/12/2025,https://www.irs.gov/pub/irs-pdf/i8609a.pdf
Form 8610,Annual Low-Income Housing Credit Agencies Report,2024,11/26/2024,https://www.irs.gov/pub/irs-pdf/f8610.pdf
Form 8610 (Schedule A),Carryover Allocation of Low-Income Housing Credit,Dec 2024,12/10/2024,https://www.irs.gov/pub/irs-pdf/f8610sa.pdf
Form 8611,Recapture of Low-Income Housing Credit,Dec 2021,12/09/2021,https://www.irs.gov/pub/irs-pdf/f8611.pdf
Form 8612,Return of Excise Tax on Undistributed Income of Real Estate Investment Trusts,Nov 2022,11/09/2022,https://www.irs.gov/pub/irs-pdf/f8612.pdf
Form 8613,Return of Excise Tax on Undistributed Income of Regulated Investment Companies,Nov 2022,11/17/2022,https://www.irs.gov/pub/irs-pdf/f8613.pdf
Form 8615,Tax for Certain Children Who Have Unearned Income,2024,11/12/2024,https://www.irs.gov/pub/irs-pdf/f8615.pdf
Instruction 8615,"Instructions for Form 8615, Tax for Certain Children Who Have Unearned Income",2024,11/21/2024,https://www.irs.gov/pub/irs-pdf/i8615.pdf
Form 8621,Information Return by a Shareholder of a Passive Foreign Investment Company or Qualified Electing Fund,Dec 2025,11/26/2025,https://www.irs.gov/pub/irs-pdf/f8621.pdf
Instruction 8621,"Instructions for Form 8621, Information Return by a Shareholder of a Passive Foreign Investment Company or Qualified Electing Fund",Dec 2024,12/26/2024,https://www.irs.gov/pub/irs-pdf/i8621.pdf
Form 8621-A,Return by a Shareholder Making Certain Late Elections To End Treatment as a Passive Foreign Investment Company,Dec 2024,02/06/2025,https://www.irs.gov/pub/irs-pdf/f8621a.pdf
Instruction 8621-A,"Instructions for Form 8621-A, Return by a Shareholder Making Certain Late Elections To End Treatment as a Passive Foreign Investment Company",Dec 2024,01/30/2025,https://www.irs.gov/pub/irs-pdf/i8621a.pdf
Form 8653,Tax Counseling for the Elderly Program Application Plan,Apr 2025,10/23/2025,https://www.irs.gov/pub/irs-pdf/f8653.pdf
Form 8654,Tax Counseling for the Elderly Program Semi-Annual/Annual Program Report,Apr 2016,04/20/2016,https://www.irs.gov/pub/irs-pdf/f8654.pdf
Form 8655,Reporting Agent Authorization,Jan 2024,01/08/2024,https://www.irs.gov/pub/irs-pdf/f8655.pdf
Form 8689,Allocation of Individual Income Tax to the U.S. Virgin Islands,2025,11/03/2025,https://www.irs.gov/pub/irs-pdf/f8689.pdf
Form 8691,Internal Revenue Service Memorandum Refund Pursuant To: Settlement/Government Concession,Jun 2022,07/05/2022,https://www.irs.gov/pub/irs-pdf/f8691.pdf
Form 8697,Interest Computation Under the Look-Back Method for Completed Long-Term Contracts,Nov 2018,11/13/2018,https://www.irs.gov/pub/irs-pdf/f8697.pdf
Instruction 8697,"Instructions for Form 8697, Interest Computation Under the Look-Back Method for Completed Long-Term Contracts",Nov 2018,11/15/2018,https://www.irs.gov/pub/irs-pdf/i8697.pdf
Form 8703,Annual Certification of a Residential Rental Project,Dec 2021,12/01/2021,https://www.irs.gov/pub/irs-pdf/f8703.pdf
Form 8716,Election to Have a Tax Year Other Than a Required Tax Year,Aug 2021,09/03/2021,https://www.irs.gov/pub/irs-pdf/f8716.pdf
Form 8717,User Fee for Employee Plan Determination Letter Request,Jun 2022,06/28/2022,https://www.irs.gov/pub/irs-pdf/f8717.pdf
Form 8717-A,User Fee for Employee Plan Opinion Letter Request,Aug 2024,09/03/2024,https://www.irs.gov/pub/irs-pdf/f8717a.pdf
Form 8718,User Fee for Exempt Organization Determination Letter Request,Nov 2021,11/16/2021,https://www.irs.gov/pub/irs-pdf/f8718.pdf
Form 8725,Excise Tax on Greenmail,Dec 2015,03/13/2019,https://www.irs.gov/pub/irs-pdf/f8725.pdf
Form 8752,Required Payment or Refund Under Section 7519,2024,11/04/2024,https://www.irs.gov/pub/irs-pdf/f8752.pdf
Form 8796-A,Request for Return/Information (Federal/State Tax Exchange Program - State and Local Government Use Only),Sep 2021,10/14/2021,https://www.irs.gov/pub/irs-pdf/f8796a.pdf
Form 8801,"Credit for Prior Year Minimum Tax - Individuals, Estates, and Trusts",2025,12/23/2025,https://www.irs.gov/pub/irs-pdf/f8801.pdf
Instruction 8801,"Instructions for Form 8801, Credit for Prior Year Minimum Tax - Individuals, Estates, and Trusts",2025,12/23/2025,https://www.irs.gov/pub/irs-pdf/i8801.pdf
Form 8802,Application for United States Residency Certification,Nov 2018,11/08/2018,https://www.irs.gov/pub/irs-pdf/f8802.pdf
Instruction 8802,"Instructions for Form 8802, Application for United States Residency Certification",Oct 2024,09/06/2024,https://www.irs.gov/pub/irs-pdf/i8802.pdf
Form 8804,Annual Return for Partnership Withholding Tax (Section 1446),Dec 2025,12/17/2025,https://www.irs.gov/pub/irs-pdf/f8804.pdf
"Instruction 8804, 8805 and 8813","Instructions for Forms 8804, 8805 and 8813",Nov 2022,11/02/2022,https://www.irs.gov/pub/irs-pdf/i8804.pdf
Form 8804-C,Certificate of Partner-Level Items to Reduce Section 1446 Withholding,Mar 2009,07/17/2012,https://www.irs.gov/pub/irs-pdf/f8804c.pdf
Instruction 8804-C,"Instructions for Form 8804-C, Certificate of Partner-Level Items to Reduce Section 1446 Withholding",Nov 2012,02/28/2024,https://www.irs.gov/pub/irs-pdf/i8804c.pdf
Form 8804 (Schedule A),Penalty for Underpayment of Estimated Section 1446 Tax by Partnerships,2025,12/08/2025,https://www.irs.gov/pub/irs-pdf/f8804sa.pdf
Instruction 8804 (Schedule A),"Instructions for Schedule A (Form 8804), Penalty for Underpayment of Estimated Section 1446 Tax by Partnerships",2025,12/08/2025,https://www.irs.gov/pub/irs-pdf/i8804sa.pdf
Form 8804-W,Installment Payments of Section 1446 Tax for Partnerships,2026,11/24/2025,https://www.irs.gov/pub/irs-pdf/f8804w.pdf
Instruction 8804-W,"Instructions for Form 8804-W, Installment Payments of Section 1446 Tax for Partnerships",2026,11/13/2025,https://www.irs.gov/pub/irs-pdf/i8804w.pdf
Form 8805,Foreign Partner's Information Statement of Section 1446 Withholding tax,Nov 2019,11/08/2019,https://www.irs.gov/pub/irs-pdf/f8805.pdf
Form 8806,Information Return for Acquisition of Control or Substantial Change in Capital Structure,Oct 2016,07/26/2022,https://www.irs.gov/pub/irs-pdf/f8806.pdf
Form 8809,Application for Extension of Time to File Information Returns,Dec 2025,12/17/2025,https://www.irs.gov/pub/irs-pdf/f8809.pdf
Form 8809-EX,Request for Extension of Time To File an ExSTARS Information Return (For Form 720TO or Form 720CS),Jan 2014,01/21/2014,https://www.irs.gov/pub/irs-pdf/f8809ex.pdf
Form 8809-I,Application for Extension of Time to File FATCA Form 8966,Nov 2015,11/17/2015,https://www.irs.gov/pub/irs-pdf/f8809i.pdf
Instruction 8809-I,"Instructions for Form 8809-I, Application for Extension of Time to File FATCA Form 8966",Nov 2015,04/01/2016,https://www.irs.gov/pub/irs-pdf/i8809i.pdf
Form 8810,Corporate Passive Activity Loss and Credit Limitations,2025,11/20/2025,https://www.irs.gov/pub/irs-pdf/f8810.pdf
Instruction 8810,"Instructions for Form 8810, Corporate Passive Activity Loss and Credit Limitations",2025,11/20/2025,https://www.irs.gov/pub/irs-pdf/i8810.pdf
Form 8811,Information Return for Real Estate Mortgage Investment Conduits (REMICs) and Issuers of Collateralized Debt Obligations,Aug 2013,09/18/2013,https://www.irs.gov/pub/irs-pdf/f8811.pdf
Form 8813,Partnership Withholding Tax Payment Voucher (Section 1446),Dec 2008,07/17/2012,https://www.irs.gov/pub/irs-pdf/f8813.pdf
Form 8814,Parents' Election to Report Child's Interest and Dividends,2024,12/12/2024,https://www.irs.gov/pub/irs-pdf/f8814.pdf
Instruction 8814,"Instructions for Form 8814, Parents' Election to Report Child's Interest and Dividends",2024,12/13/2024,https://www.irs.gov/pub/irs-pdf/i8814.pdf
Form 8815,Exclusion of Interest From Series EE and I U.S. Savings Bonds Issued After 1989,2025,12/16/2025,https://www.irs.gov/pub/irs-pdf/f8815.pdf
Form 8818,Optional Form To Record Redemption of Series EE and I U.S. Savings Bonds Issued After 1989,Dec 2007,07/17/2012,https://www.irs.gov/pub/irs-pdf/f8818.pdf
Form 8819,Dollar Election Under Section 985,Sep 2017,09/16/2017,https://www.irs.gov/pub/irs-pdf/f8819.pdf
Form 8820,Orphan Drug Credit,Sep 2018,09/27/2018,https://www.irs.gov/pub/irs-pdf/f8820.pdf
Form 8821,Tax Information Authorization,Jan 2021,01/22/2021,https://www.irs.gov/pub/irs-pdf/f8821.pdf
Instruction 8821,"Instructions for Form 8821, Tax Information Authorization",Sep 2021,09/02/2021,https://www.irs.gov/pub/irs-pdf/i8821.pdf
Form 8821-A,IRS Disclosure Authorization for Victims of Identity Theft,Oct 2021,10/26/2021,https://www.irs.gov/pub/irs-pdf/f8821a.pdf
Form 8821 (sp),Tax Information Authorization (Spanish Version),Jan 2021,12/02/2021,https://www.irs.gov/pub/irs-pdf/f8821sp.pdf
Instruction 8821 (SP),"Instructions for Form 8821, Tax Information Authorization (Spanish Version)",Sep 2021,01/24/2022,https://www.irs.gov/pub/irs-pdf/i8821sp.pdf
Instruction 8821 (zh-t),"Instructions for Form 8821, Tax Information Authorization (Chinese-Traditional Version)",Sep 2021,07/22/2022,https://www.irs.gov/pub/irs-pdf/i8821zht.pdf
Form 8822,Change of Address,Feb 2021,01/26/2021,https://www.irs.gov/pub/irs-pdf/f8822.pdf
Form 8822-B,Change of Address or Responsible Party - Business,Dec 2019,06/05/2020,https://www.irs.gov/pub/irs-pdf/f8822b.pdf
Form 8823,Low-Income Housing Credit Agencies Report of Noncompliance or Building Disposition,Jun 2023,08/31/2023,https://www.irs.gov/pub/irs-pdf/f8823.pdf
Form 8824,Like-Kind Exchanges,2025,11/05/2025,https://www.irs.gov/pub/irs-pdf/f8824.pdf
Instruction 8824,"Instructions for Form 8824, Like-Kind Exchanges",2025,12/04/2025,https://www.irs.gov/pub/irs-pdf/i8824.pdf
Form 8825,Rental Real Estate Income and Expenses of a Partnership or an S Corporation,Nov 2018,11/14/2018,https://www.irs.gov/pub/irs-pdf/f8825.pdf
Form 8826,Disabled Access Credit,Sep 2017,09/16/2017,https://www.irs.gov/pub/irs-pdf/f8826.pdf
Form 8827,Credit for Prior Year Minimum Tax - Corporations,Dec 2024,01/08/2025,https://www.irs.gov/pub/irs-pdf/f8827.pdf
Form 8828,Recapture of Federal Mortgage Subsidy,Nov 2024,12/11/2024,https://www.irs.gov/pub/irs-pdf/f8828.pdf
Instruction 8828,"Instructions for Form 8828, Recapture of Federal Mortgage Subsidy",Nov 2024,01/22/2025,https://www.irs.gov/pub/irs-pdf/i8828.pdf
Form 8829,Expenses for Business Use of Your Home,2025,11/17/2025,https://www.irs.gov/pub/irs-pdf/f8829.pdf
Instruction 8829,"Instructions for Form 8829, Expenses for Business Use of Your Home",2025,11/17/2025,https://www.irs.gov/pub/irs-pdf/i8829.pdf
Form 8830,Enhanced Oil Recovery Credit,Mar 2022,03/23/2022,https://www.irs.gov/pub/irs-pdf/f8830.pdf
Form 8831,Excise Taxes on Excess Inclusions of REMIC Residual Interests,Apr 2018,03/13/2019,https://www.irs.gov/pub/irs-pdf/f8831.pdf
Form 8832,Entity Classification Election,Dec 2013,08/08/2022,https://www.irs.gov/pub/irs-pdf/f8832.pdf
Form 8833,Treaty-Based Return Position Disclosure Under Section 6114 or 7701(b),Dec 2022,11/30/2022,https://www.irs.gov/pub/irs-pdf/f8833.pdf
Form 8834,Qualified Electric Vehicle Credit,Oct 2024,11/04/2024,https://www.irs.gov/pub/irs-pdf/f8834.pdf
Form 8835,Renewable Electricity Production Credit,2024,12/19/2024,https://www.irs.gov/pub/irs-pdf/f8835.pdf
Instruction 8835,"Instructions for Form 8835, Renewable Electricity Production Credit",2024,01/15/2025,https://www.irs.gov/pub/irs-pdf/i8835.pdf
Form 8838,Consent to Extend the Time to Assess Tax Under Section 367 - Gain Recognition Agreement,Dec 2012,11/08/2012,https://www.irs.gov/pub/irs-pdf/f8838.pdf
Form 8838-P,Consent to Extend the Time to Assess Tax Pursuant to the Gain Deferral Method (Section 721(c)),Oct 2021,11/16/2021,https://www.irs.gov/pub/irs-pdf/f8838p.pdf
Form 8839,Qualified Adoption Expenses,2025,12/17/2025,https://www.irs.gov/pub/irs-pdf/f8839.pdf
Instruction 8839,"Instructions for Form 8839, Qualified Adoption Expenses",2025,12/17/2025,https://www.irs.gov/pub/irs-pdf/i8839.pdf
Form 8840,Closer Connection Exception Statement for Aliens,2025,10/28/2025,https://www.irs.gov/pub/irs-pdf/f8840.pdf
Form 8842,Election to Use Different Annualization Periods for Corporation Estimated Tax,Oct 2021,11/02/2021,https://www.irs.gov/pub/irs-pdf/f8842.pdf
Form 8843,Statement for Exempt Individuals and Individuals With a Medical Condition,2025,11/03/2025,https://www.irs.gov/pub/irs-pdf/f8843.pdf
Form 8844,Empowerment Zone Employment Credit,Mar 2020,03/17/2020,https://www.irs.gov/pub/irs-pdf/f8844.pdf
Instruction 8844,"Instructions for Form 8844, Empowerment Zone Employment Credit",Dec 2021,12/08/2021,https://www.irs.gov/pub/irs-pdf/i8844.pdf
Instruction 8845,"Instructions for Form 8845, Indian Employment Credit",Jan 2022,01/10/2022,https://www.irs.gov/pub/irs-pdf/i8845.pdf
Form 8846,Credit for Employer Social Security and Medicare Taxes Paid on Certain Employee Tips,2025,12/23/2025,https://www.irs.gov/pub/irs-pdf/f8846.pdf
Form 8848,Consent to Extend the Time to Assess the Branch Profits Tax Under Regulations Sections 1.884-2T(a) and (c),Sep 2017,09/16/2017,https://www.irs.gov/pub/irs-pdf/f8848.pdf
Form 8849,Claim for Refund of Excise Taxes,Aug 2014,08/21/2014,https://www.irs.gov/pub/irs-pdf/f8849.pdf
Form 8849 (Schedule 1),Nontaxable Use of Fuels,May 2020,06/01/2020,https://www.irs.gov/pub/irs-pdf/f8849s1.pdf
Form 8849 (Schedule 2),Sales by Registered Ultimate Vendors,Dec 2020,12/08/2020,https://www.irs.gov/pub/irs-pdf/f8849s2.pdf
Form 8849 (Schedule 3),Certain Fuel Mixtures and the Alternative Fuel Credit,Jan 2023,02/06/2023,https://www.irs.gov/pub/irs-pdf/f8849s3.pdf
Form 8849 (Schedule 5),Section 4081(e) Claims,Jan 2006,07/17/2012,https://www.irs.gov/pub/irs-pdf/f8849s5.pdf
Form 8849 (Schedule 6),Other Claims,Aug 2013,09/19/2014,https://www.irs.gov/pub/irs-pdf/f8849s6.pdf
Instruction 8849 (Schedule 6),"Instructions for Schedule 6, Form 8849 Other Claims",Oct 2025,12/04/2025,https://www.irs.gov/pub/irs-pdf/i8849s6.pdf
Form 8849 (Schedule 8),Registered Credit Card Issuers,Oct 2006,07/17/2012,https://www.irs.gov/pub/irs-pdf/f8849s8.pdf
Form 8850,Pre-Screening Notice and Certification Request for the Work Opportunity Credit,Mar 2016,03/22/2016,https://www.irs.gov/pub/irs-pdf/f8850.pdf
Instruction 8850,"Instructions for Form 8850, Pre-Screening Notice and Certification Request for the Work Opportunity Credit",Mar 2021,03/17/2021,https://www.irs.gov/pub/irs-pdf/i8850.pdf
Form 8851,Summary of Archer MSAs,Feb 2007,07/17/2012,https://www.irs.gov/pub/irs-pdf/f8851.pdf
Form 8853,Archer MSAs and Long-Term Care Insurance Contracts,2025,12/19/2025,https://www.irs.gov/pub/irs-pdf/f8853.pdf
Instruction 8853,"Instructions for Form 8853, Archer MSAs and Long-Term Care Insurance Contracts",2025,12/18/2025,https://www.irs.gov/pub/irs-pdf/i8853.pdf
Form 8854,Initial and Annual Expatriation Information Statement,2025,12/01/2025,https://www.irs.gov/pub/irs-pdf/f8854.pdf
Instruction 8854,"Instructions for Form 8854, Initial and Annual Expatriation Statement",2025,12/01/2025,https://www.irs.gov/pub/irs-pdf/i8854.pdf
Form 8855,Election to Treat a Qualified Revocable Trust as Part of an Estate,Dec 2020,12/11/2020,https://www.irs.gov/pub/irs-pdf/f8855.pdf
Form 8857,Request for Innocent Spouse Relief,Jun 2021,07/30/2021,https://www.irs.gov/pub/irs-pdf/f8857.pdf
Instruction 8857,"Instructions for Form 8857, Request for Innocent Spouse Relief",Jun 2021,07/30/2021,https://www.irs.gov/pub/irs-pdf/i8857.pdf
Form 8857 (SP),Solicitud para Alivio del Conyuge Inocente,Jul 2021,08/06/2021,https://www.irs.gov/pub/irs-pdf/f8857sp.pdf
Instruction 8857 (SP),"Instrucciones para el Formulario 8857(SP), Solicitud para Alivio del Conyuge Inocente",Jul 2021,08/06/2021,https://www.irs.gov/pub/irs-pdf/i8857sp.pdf
Form 8858,Information Return of U.S. Persons With Respect to Foreign Disregarded Entities (FDEs) and Foreign Branches (FBs),Dec 2024,12/11/2024,https://www.irs.gov/pub/irs-pdf/f8858.pdf
Instruction 8858,"Instructions for Form 8858, Information Return of U.S. Persons With Respect To Foreign Disregarded Entities (FDEs) and Foreign Branches (FBs)",Dec 2024,12/09/2024,https://www.irs.gov/pub/irs-pdf/i8858.pdf
Form 8858 (Schedule M),Transactions Between Foreign Disregarded Entity (FDE) or Foreign Branch (FB) and the Filer or Other Related Entities,Sep 2021,09/30/2021,https://www.irs.gov/pub/irs-pdf/f8858sm.pdf
Form 8859,Carryforward of the District of Columbia First-Time Homebuyer Credit,2025,12/04/2025,https://www.irs.gov/pub/irs-pdf/f8859.pdf
Form 8862,Information To Claim Certain Credits After Disallowance,Oct 2024,10/30/2024,https://www.irs.gov/pub/irs-pdf/f8862.pdf
Instruction 8862,"Instructions for Form 8862, Information to Claim Certain Credits After Disallowance",Oct 2024,11/06/2024,https://www.irs.gov/pub/irs-pdf/i8862.pdf
Form 8862 (sp),Information To Claim Certain Credits After Disallowance (Spanish Version),Oct 2024,10/30/2024,https://www.irs.gov/pub/irs-pdf/f8862sp.pdf
Instruction 8862 (sp),"Instructions for Form 8862 (sp), Information to Claim Certain Credits After Disallowance (Spanish Version)",Oct 2024,11/06/2024,https://www.irs.gov/pub/irs-pdf/i8862sp.pdf
Form 8862 (zh-s),Information To Claim Earned Income Credit After Disallowance (Chinese-Simplified Version),Dec 2022,10/02/2023,https://www.irs.gov/pub/irs-pdf/f8862zhs.pdf
Instruction 8862 (zh-s),"Instructions for Form 8862, Information to Claim Earned Income Credit After Disallowance (Chinese-Simplified Version)",Dec 2022,06/21/2023,https://www.irs.gov/pub/irs-pdf/i8862zhs.pdf
Form 8862 (zh-t),Information To Claim Earned Income Credit After Disallowance (Chinese-Traditional Version),Dec 2022,10/02/2023,https://www.irs.gov/pub/irs-pdf/f8862zht.pdf
Instruction 8862 (zh-t),"Instructions for Form 8862 (zh-t), Information to Claim Earned Income Credit After Disallowance (Chinese-Traditional Version)",Dec 2022,06/21/2023,https://www.irs.gov/pub/irs-pdf/i8862zht.pdf
Form 8863,Education Credits (American Opportunity and Lifetime Learning Credits),2025,11/06/2025,https://www.irs.gov/pub/irs-pdf/f8863.pdf
Instruction 8863,"Instructions for Form 8863, Education Credits (American Opportunity and Lifetime Learning Credits)",2025,11/06/2025,https://www.irs.gov/pub/irs-pdf/i8863.pdf
Form 8864,Biodiesel and Renewable Diesel Fuels Credit,Jan 2023,01/24/2023,https://www.irs.gov/pub/irs-pdf/f8864.pdf
Instruction 8864,"Instructions for Form 8864, Biodiesel and Renewable Diesel Fuels Credit",Jan 2023,01/26/2023,https://www.irs.gov/pub/irs-pdf/i8864.pdf
Form 8865,Return of U.S. Persons With Respect to Certain Foreign Partnerships,2024,11/12/2024,https://www.irs.gov/pub/irs-pdf/f8865.pdf
Instruction 8865,"Instructions for Form 8865, Return of U.S. Persons With Respect to Certain Foreign Partnerships",2024,01/06/2025,https://www.irs.gov/pub/irs-pdf/i8865.pdf
Form 8865 (Schedule G),Statement of Application of the Gain Deferral Method Under Section 721(c),Dec 2021,12/21/2021,https://www.irs.gov/pub/irs-pdf/f8865sg.pdf
Form 8865 (Schedule H),Acceleration Events and Exceptions Reporting Relating to Gain Deferral Method Under Section 721(c),Nov 2018,12/20/2018,https://www.irs.gov/pub/irs-pdf/f8865sh.pdf
Form 8865 (Schedule K-1),"Partner's Share of Income, Deductions, Credits, etc.",2024,11/07/2024,https://www.irs.gov/pub/irs-pdf/f8865sk1.pdf
Form 8865 (Schedule K-2),Partners' Distributive Share Items - International,2024,01/14/2025,https://www.irs.gov/pub/irs-pdf/f8865sk2.pdf
Instruction 8865 (Schedule K-2 & K-3),"Instructions for Schedules K-2 and K-3 (Form 8865), Partners' Distributive Share Items - International and Partner's Share of Income, Deductions, Credits, etc. - International",2024,01/07/2025,https://www.irs.gov/pub/irs-pdf/i8865k23.pdf
Form 8865 (Schedule K-3),"Partner's Share of Income, Deductions, Credits, etc.-International",2024,01/08/2025,https://www.irs.gov/pub/irs-pdf/f8865sk3.pdf
Form 8865 (Schedule O),Transfer of Property to a Foreign Partnership (under section 6038B),Oct 2021,10/04/2021,https://www.irs.gov/pub/irs-pdf/f8865so.pdf
