Product Number,Title,Revision Date,Posted Date,PDF Link
Publication 1,Your Rights As A Taxpayer,Sep 2017,10/31/2017,https://www.irs.gov/pub/irs-pdf/p1.pdf
Publication 1 (AR),Your Rights As A Taxpayer (Arabic Version),Sep 2017,08/05/2020,https://www.irs.gov/pub/irs-pdf/p1ar.pdf
Publication 1 (BN),Your Rights As A Taxpayer (Bengali Version),Sep 2017,07/31/2020,https://www.irs.gov/pub/irs-pdf/p1bn.pdf
Publication 1 (FA),Your Rights As A Taxpayer (Farsi Version),Sep 2017,07/31/2020,https://www.irs.gov/pub/irs-pdf/p1fa.pdf
Publication 1 (FR),Your Rights As A Taxpayer (French Version),Sep 2017,07/31/2020,https://www.irs.gov/pub/irs-pdf/p1fr.pdf
Publication 1 (GUJ),Your Rights As A Taxpayer (Gujarati Version),Sep 2017,07/31/2020,https://www.irs.gov/pub/irs-pdf/p1guj.pdf
Publication 1 (HT),Your Rights As A Taxpayer (Haitian Creole Version),Sep 2017,07/31/2020,https://www.irs.gov/pub/irs-pdf/p1ht.pdf
Publication 1 (IT),Your Rights As A Taxpayer (Italian Version),Sep 2017,07/31/2020,https://www.irs.gov/pub/irs-pdf/p1it.pdf
Publication 1 (JA),Your Rights As A Taxpayer (Japanese Version),Sep 2017,07/31/2020,https://www.irs.gov/pub/irs-pdf/p1ja.pdf
Publication 1 (KM),Your Rights As A Taxpayer (Khmer-Central (Cambodia) Version),Sep 2017,07/31/2020,https://www.irs.gov/pub/irs-pdf/p1km.pdf
Publication 1 (KO),Your Rights As A Taxpayer (Korean Version),Sep 2017,07/31/2020,https://www.irs.gov/pub/irs-pdf/p1ko.pdf
Publication 1 (PA),Your Rights As A Taxpayer (Punjabi Version),Sep 2017,07/31/2020,https://www.irs.gov/pub/irs-pdf/p1pa.pdf
Publication 1 (PL),Your Rights As A Taxpayer (Polish Version),Sep 2017,07/31/2020,https://www.irs.gov/pub/irs-pdf/p1pl.pdf
Publication 1 (PT),Your Rights As A Taxpayer (Portuguese Version),Sep 2017,07/31/2020,https://www.irs.gov/pub/irs-pdf/p1pt.pdf
Publication 1 (RU),Your Rights As A Taxpayer (Russian Version),Sep 2017,07/31/2020,https://www.irs.gov/pub/irs-pdf/p1ru.pdf
Publication 1 (SP),Your Rights As A Taxpayer (Spanish Version),Oct 2017,05/18/2020,https://www.irs.gov/pub/irs-pdf/p1sp.pdf
Publication 1 (TL),Your Rights As A Taxpayer (Tagalog Version),Sep 2017,07/31/2020,https://www.irs.gov/pub/irs-pdf/p1tl.pdf
Publication 1 (UR),Your Rights As A Taxpayer (Urdu Version),Sep 2017,07/31/2020,https://www.irs.gov/pub/irs-pdf/p1ur.pdf
Publication 1 (VIE),Your Rights As A Taxpayer (Vietnamese Version),Sep 2017,07/31/2020,https://www.irs.gov/pub/irs-pdf/p1vie.pdf
Publication 1 (ZH-S),Your Rights As A Taxpayer (Chinese-Simplied Version),Sep 2017,07/31/2020,https://www.irs.gov/pub/irs-pdf/p1zhs.pdf
Publication 1 (ZH-T),Your Rights As A Taxpayer (Chinese-Traditional Version),Sep 2017,08/27/2020,https://www.irs.gov/pub/irs-pdf/p1zht.pdf
Publication 3,Armed Forces' Tax Guide,2024,03/24/2025,https://www.irs.gov/pub/irs-pdf/p3.pdf
Publication 5,Your Appeal Rights and How to Prepare a Protest if You Disagree,Apr 2021,05/11/2021,https://www.irs.gov/pub/irs-pdf/p5.pdf
Publication 5 (sp),Your Appeal Rights and How to Prepare a Protest if you Don't Agree (Spanish version),Apr 2021,10/21/2021,https://www.irs.gov/pub/irs-pdf/p5sp.pdf
Form 11-C,Occupational Tax and Registration Return for Wagering,Dec 2017,12/21/2017,https://www.irs.gov/pub/irs-pdf/f11c.pdf
Publication 15,(Circular E) Employer's Tax Guide,2026,12/17/2025,https://www.irs.gov/pub/irs-pdf/p15.pdf
Publication 15-A,Employer's Supplemental Tax Guide,2026,12/17/2025,https://www.irs.gov/pub/irs-pdf/p15a.pdf
Publication 15-B,Employers Tax Guide to Fringe Benefits,2026,12/23/2025,https://www.irs.gov/pub/irs-pdf/p15b.pdf
Publication 15 (sp),"Circular E, Employer's Tax Guide (Spanish Version)",2025,02/05/2025,https://www.irs.gov/pub/irs-pdf/p15sp.pdf
Publication 15-T,Federal Income Tax Withholding Methods,2026,12/11/2025,https://www.irs.gov/pub/irs-pdf/p15t.pdf
Publication 16,Statistics of Income - Corporation Income Tax Returns Complete Report,Sep 2025,09/30/2025,https://www.irs.gov/pub/irs-pdf/p16.pdf
Publication 17,Your Federal Income Tax (For Individuals),2025,12/19/2025,https://www.irs.gov/pub/irs-pdf/p17.pdf
Publication 17 (ko),Your Federal Income Tax (Korean version),2024,03/05/2025,https://www.irs.gov/pub/irs-pdf/p17ko.pdf
Publication 17 (ru),Your Federal Income Tax (Russian version),2024,03/06/2025,https://www.irs.gov/pub/irs-pdf/p17ru.pdf
Publication 17 (sp),Your Federal Income Tax (Spanish version),2024,01/17/2025,https://www.irs.gov/pub/irs-pdf/p17sp.pdf
Publication 17 (vie),Your Federal Income Tax (Vietnamese Version),2024,02/06/2025,https://www.irs.gov/pub/irs-pdf/p17vie.pdf
Publication 17 (zh-s),Your Federal Income Tax (Chinese-Simplified Version),2024,03/03/2025,https://www.irs.gov/pub/irs-pdf/p17zhs.pdf
Publication 17 (zh-t),Your Federal Income Tax (Chinese-Traditional Version),2024,03/18/2025,https://www.irs.gov/pub/irs-pdf/p17zht.pdf
Form 23,Application for Enrollment to Practice Before the Internal Revenue Service,Nov 2022,11/04/2022,https://www.irs.gov/pub/irs-pdf/f23.pdf
Publication 54,Tax Guide for U.S. Citizens and Resident Aliens Abroad,2024,02/06/2025,https://www.irs.gov/pub/irs-pdf/p54.pdf
Publication 55-B,Internal Revenue Service Data Book,May 2025,05/20/2025,https://www.irs.gov/pub/irs-pdf/p55b.pdf
Form 56,Notice Concerning Fiduciary Relationship,Nov 2022,11/16/2022,https://www.irs.gov/pub/irs-pdf/f56.pdf
Instruction 56,"Instructions for Form 56, Notice Concerning Fiduciary Relationship",Dec 2024,01/07/2025,https://www.irs.gov/pub/irs-pdf/i56.pdf
Form 56-F,Notice Concerning Fiduciary Relationship of Financial Institution,Dec 2022,11/29/2022,https://www.irs.gov/pub/irs-pdf/f56f.pdf
Form 172,"Net Operating Losses (NOLs) For Individuals, Estates, and Trusts",Dec 2024,01/16/2025,https://www.irs.gov/pub/irs-pdf/f172.pdf
Instruction 172,"Instructions for Form 172, Net Operating Losses (NOLs) for Individuals, Estates, and Trusts",Dec 2024,01/16/2025,https://www.irs.gov/pub/irs-pdf/i172.pdf
Form 211,Application for Reward for Original Information,Mar 2024,03/24/2024,https://www.irs.gov/pub/irs-pdf/f211.pdf
Publication 216,Conferences and Practice Requirements,Mar 1992,07/17/2012,https://www.irs.gov/pub/irs-pdf/p216.pdf
Publication 225,Farmer's Tax Guide,2025,11/07/2025,https://www.irs.gov/pub/irs-pdf/p225.pdf
Publication 334,Tax Guide for Small Business (For Individuals Who Use Schedule C),2024,12/26/2024,https://www.irs.gov/pub/irs-pdf/p334.pdf
Publication 334 (ko),Tax Guide For Small Business (For Individuals Who Use Schedule C) (Korean Version),2024,02/20/2025,https://www.irs.gov/pub/irs-pdf/p334ko.pdf
Publication 334 (ru),Tax Guide For Small Business (For Individuals Who Use Schedule C) (Russian Version),2024,03/20/2025,https://www.irs.gov/pub/irs-pdf/p334ru.pdf
Publication 334 (sp),Tax Guide For Small Business (For Individuals Who Use Schedule C) (Spanish Version),2024,02/20/2025,https://www.irs.gov/pub/irs-pdf/p334sp.pdf
Publication 334 (vie),Tax Guide For Small Business (For Individuals Who Use Schedule C) (Vietnamese Version),2024,01/21/2025,https://www.irs.gov/pub/irs-pdf/p334vie.pdf
Publication 334 (zh-s),Tax Guide for Small Business (For Individuals Who Use Schedule C) (Chinese-Simplified Version),2024,03/20/2025,https://www.irs.gov/pub/irs-pdf/p334zhs.pdf
Publication 334 (zh-t),Tax Guide for Small Business (For Individuals Who Use Schedule C) (Chinese-Traditional Version),2024,04/18/2025,https://www.irs.gov/pub/irs-pdf/p334zht.pdf
Form 433-A,Collection Information Statement for Wage Earners and Self-Employed Individuals,Jul 2022,08/05/2022,https://www.irs.gov/pub/irs-pdf/f433a.pdf
Form 433-A (OIC),Collection Information Statement for Wage Earners and Self-Employed Individuals,Apr 2025,04/18/2025,https://www.irs.gov/pub/irs-pdf/f433aoi.pdf
Form 433-A (OIC) (sp),Collection Information Statement for Wage Earners and Self-Employed Individuals (Spanish Version),Apr 2025,04/18/2025,https://www.irs.gov/pub/irs-pdf/f433aois.pdf
Form 433-A (sp),Collection Information Statement for Wage Earners and Self-Employed Individuals (Spanish Version),Jul 2022,12/19/2024,https://www.irs.gov/pub/irs-pdf/f433asp.pdf
Form 433-B,Collection Information Statement for Businesses,Feb 2019,02/19/2019,https://www.irs.gov/pub/irs-pdf/f433b.pdf
Form 433-B (OIC),Collection Information Statement for Businesses,Apr 2025,04/18/2025,https://www.irs.gov/pub/irs-pdf/f433boi.pdf
Form 433-B (OIC) (sp),Collection Information Statement for Businesses (Spanish Version),Apr 2025,04/18/2025,https://www.irs.gov/pub/irs-pdf/f433bois.pdf
Form 433-B (SP),Collection Information Statement for Businesses (Spanish Version),Feb 2019,02/28/2020,https://www.irs.gov/pub/irs-pdf/f433bsp.pdf
Form 433-D,Installment Agreement,Jul 2024,07/01/2024,https://www.irs.gov/pub/irs-pdf/f433d.pdf
Form 433-D (sp),Installment Agreement (Spanish version),Jul 2024,08/07/2024,https://www.irs.gov/pub/irs-pdf/f433dsp.pdf
Form 433-F,Collection Information Statement,Jul 2024,04/01/2025,https://www.irs.gov/pub/irs-pdf/f433f.pdf
Form 433-F (sp),Collection Information Statement (Spanish version),Jul 2024,12/17/2024,https://www.irs.gov/pub/irs-pdf/f433fsp.pdf
Form 433-H,Installment Agreement Request and Collection Information Statement,Mar 2025,04/01/2025,https://www.irs.gov/pub/irs-pdf/f433h.pdf
Form 433-H (sp),Installment Agreement Request and Collection Information Statement (Spanish Version),Jul 2024,09/04/2024,https://www.irs.gov/pub/irs-pdf/f433hsp.pdf
Form 461,Limitation on Business Losses,2025,12/10/2025,https://www.irs.gov/pub/irs-pdf/f461.pdf
Instruction 461,"Instructions for Form 461, Limitation on Business Losses",2025,12/11/2025,https://www.irs.gov/pub/irs-pdf/i461.pdf
Publication 463,"Travel, Gift, and Car Expenses",2024,02/28/2025,https://www.irs.gov/pub/irs-pdf/p463.pdf
Publication 487,How to Prepare Application to Release Property Secured by Federal Tax Lien,Jan 2006,07/17/2012,https://www.irs.gov/pub/irs-pdf/p487.pdf
Publication 501,"Dependents, Standard Deduction, and Filing Information",2024,12/18/2024,https://www.irs.gov/pub/irs-pdf/p501.pdf
Publication 502,Medical and Dental Expenses,2024,12/11/2024,https://www.irs.gov/pub/irs-pdf/p502.pdf
Publication 503,Child and Dependent Care Expenses,2025,12/22/2025,https://www.irs.gov/pub/irs-pdf/p503.pdf
Publication 504,Divorced or Separated Individuals,2025,11/28/2025,https://www.irs.gov/pub/irs-pdf/p504.pdf
Publication 505,Tax Withholding and Estimated Tax,2025,03/18/2025,https://www.irs.gov/pub/irs-pdf/p505.pdf
Publication 509,Tax Calendars,2026,12/04/2025,https://www.irs.gov/pub/irs-pdf/p509.pdf
Publication 510,Excise Taxes,Mar 2025,05/08/2025,https://www.irs.gov/pub/irs-pdf/p510.pdf
Publication 514,Foreign Tax Credit for Individuals,2024,01/27/2025,https://www.irs.gov/pub/irs-pdf/p514.pdf
Publication 515,Withholding of Tax on Nonresident Aliens and Foreign Entities,2025,02/06/2025,https://www.irs.gov/pub/irs-pdf/p515.pdf
Publication 516,U.S. Government Civilian Employees Stationed Abroad,Nov 2024,12/11/2024,https://www.irs.gov/pub/irs-pdf/p516.pdf
Publication 517,Social Security and Other Information for Members of the Clergy and Religious Workers,2024,01/23/2025,https://www.irs.gov/pub/irs-pdf/p517.pdf
Publication 519,U.S. Tax Guide for Aliens,2024,03/18/2025,https://www.irs.gov/pub/irs-pdf/p519.pdf
Publication 519 (ko),U.S. Tax Guide for Aliens (Korean Version),2024,03/26/2025,https://www.irs.gov/pub/irs-pdf/p519ko.pdf
Publication 519 (ru),U.S. Tax Guide for Aliens (Russian Version),2024,04/23/2025,https://www.irs.gov/pub/irs-pdf/p519ru.pdf
Publication 519 (sp),U.S. Tax Guide for Aliens (Spanish Version),2024,04/02/2025,https://www.irs.gov/pub/irs-pdf/p519sp.pdf
Publication 519 (vie),U.S. Tax Guide for Aliens (Vietnamese Version),2024,03/18/2025,https://www.irs.gov/pub/irs-pdf/p519vie.pdf
Publication 519 (zh-s),U.S. Tax Guide for Aliens (Chinese-Simplified Version),2024,04/09/2025,https://www.irs.gov/pub/irs-pdf/p519zhs.pdf
Publication 519 (zh-t),U.S. Tax Guide for Aliens (Chinese-Traditional Version),2024,06/03/2025,https://www.irs.gov/pub/irs-pdf/p519zht.pdf
Publication 523,Selling Your Home,2024,02/13/2025,https://www.irs.gov/pub/irs-pdf/p523.pdf
Publication 524,Credit for the Elderly or the Disabled,2023,01/16/2024,https://www.irs.gov/pub/irs-pdf/p524.pdf
Publication 525,Taxable and Nontaxable Income,2024,02/13/2025,https://www.irs.gov/pub/irs-pdf/p525.pdf
Publication 526,Charitable Contributions,2024,02/27/2025,https://www.irs.gov/pub/irs-pdf/p526.pdf
Publication 527,Residential Rental Property (Including Rental of Vacation Homes),2024,12/23/2024,https://www.irs.gov/pub/irs-pdf/p527.pdf
Publication 529,Miscellaneous Deductions,Dec 2020,01/05/2021,https://www.irs.gov/pub/irs-pdf/p529.pdf
Publication 530,Tax Information for Homeowners,2024,02/07/2025,https://www.irs.gov/pub/irs-pdf/p530.pdf
Publication 531,Reporting Tip Income,Dec 2024,12/11/2024,https://www.irs.gov/pub/irs-pdf/p531.pdf
Publication 534,Depreciating Property Placed In Service Before 1987,Nov 2016,11/07/2016,https://www.irs.gov/pub/irs-pdf/p534.pdf
Publication 537,Installment Sales,2024,12/19/2024,https://www.irs.gov/pub/irs-pdf/p537.pdf
Publication 538,Accounting Periods and Methods,Jan 2022,02/15/2022,https://www.irs.gov/pub/irs-pdf/p538.pdf
Publication 541,Partnerships,Dec 2024,02/04/2025,https://www.irs.gov/pub/irs-pdf/p541.pdf
Publication 542,Corporations,Jan 2024,02/13/2024,https://www.irs.gov/pub/irs-pdf/p542.pdf
Publication 544,Sales and Other Dispositions of Assets,2024,02/28/2025,https://www.irs.gov/pub/irs-pdf/p544.pdf
Publication 547,"Casualties, Disasters, and Thefts",2024,02/11/2025,https://www.irs.gov/pub/irs-pdf/p547.pdf
Publication 547 (ko),"Casualties, Disasters, and Thefts (Korean Version)",2024,03/10/2025,https://www.irs.gov/pub/irs-pdf/p547ko.pdf
Publication 547 (ru),"Casualties, Disasters, and Thefts (Russian Version)",2024,03/27/2025,https://www.irs.gov/pub/irs-pdf/p547ru.pdf
Publication 547 (sp),"Casualties, Disasters, and Thefts (Spanish Version)",2024,02/28/2025,https://www.irs.gov/pub/irs-pdf/p547sp.pdf
Publication 547 (vie),"Casualties, Disasters, and Thefts (Vietnamese Version)",2024,02/20/2025,https://www.irs.gov/pub/irs-pdf/p547vie.pdf
Publication 547 (zh-s),"Casualties, Disasters, and Thefts (Chinese-Simplified Version)",2024,03/26/2025,https://www.irs.gov/pub/irs-pdf/p547zhs.pdf
Publication 547 (zh-t),"Casualties, Disasters, and Thefts (Chinese-Traditional Version)",2024,04/01/2025,https://www.irs.gov/pub/irs-pdf/p547zht.pdf
Publication 550,Investment Income and Expenses (Including Capital Gains and Losses),2024,02/28/2025,https://www.irs.gov/pub/irs-pdf/p550.pdf
Publication 551,Basis of Assets,Dec 2024,02/27/2025,https://www.irs.gov/pub/irs-pdf/p551.pdf
Publication 554,Tax Guide for Seniors,2024,01/06/2025,https://www.irs.gov/pub/irs-pdf/p554.pdf
Publication 555,Community Property,Dec 2024,02/19/2025,https://www.irs.gov/pub/irs-pdf/p555.pdf
Publication 556,"Examination of Returns, Appeal Rights, and Claims for Refund",Sep 2013,10/01/2013,https://www.irs.gov/pub/irs-pdf/p556.pdf
Publication 557,Tax-Exempt Status for Your Organization,Jan 2025,02/28/2025,https://www.irs.gov/pub/irs-pdf/p557.pdf
Publication 559,"Survivors, Executors and Administrators",2024,02/27/2025,https://www.irs.gov/pub/irs-pdf/p559.pdf
Publication 560,"Retirement Plans for Small Business (SEP, SIMPLE and Qualified Plans)",2024,03/18/2025,https://www.irs.gov/pub/irs-pdf/p560.pdf
Publication 561,Determining the Value of Donated Property,Dec 2024,02/12/2025,https://www.irs.gov/pub/irs-pdf/p561.pdf
Publication 570,Tax Guide for Individuals With Income From U.S. Territories,2024,02/28/2025,https://www.irs.gov/pub/irs-pdf/p570.pdf
Publication 571,Tax-Sheltered Annuity Plans (403(b) Plans) For Employees of Public Schools and Certain Tax-Exempt Organizations,Jan 2025,01/29/2025,https://www.irs.gov/pub/irs-pdf/p571.pdf
Publication 575,Pension and Annuity Income,2024,03/13/2025,https://www.irs.gov/pub/irs-pdf/p575.pdf
Publication 583,Starting a Business and Keeping Records,Dec 2024,01/29/2025,https://www.irs.gov/pub/irs-pdf/p583.pdf
Publication 584,"Casualty, Disaster, and Theft Loss Workbook (Personal-Use Property)",Dec 2024,02/11/2025,https://www.irs.gov/pub/irs-pdf/p584.pdf
Publication 584-B,"Business Casualty, Disaster, and Theft Loss Workbook",Dec 2024,02/10/2025,https://www.irs.gov/pub/irs-pdf/p584b.pdf
Publication 584 (sp),"Casualty, Disaster, and Theft Loss Workbook (Personal-Use Property) (Spanish Version)",Dec 2024,02/18/2025,https://www.irs.gov/pub/irs-pdf/p584sp.pdf
Publication 587,Business Use of Your Home (Including Use by Daycare Providers),2024,12/23/2024,https://www.irs.gov/pub/irs-pdf/p587.pdf
Publication 590-A,Contributions to Individual Retirement Arrangements (IRAs),2024,02/03/2025,https://www.irs.gov/pub/irs-pdf/p590a.pdf
Publication 590-B,Distributions from Individual Retirement Arrangements (IRAs),2024,03/19/2025,https://www.irs.gov/pub/irs-pdf/p590b.pdf
Publication 594,The IRS Collection Process,Jan 2026,12/11/2025,https://www.irs.gov/pub/irs-pdf/p594.pdf
Publication 594 (sp),The IRS Collection Process (Spanish Version),May 2024,06/03/2024,https://www.irs.gov/pub/irs-pdf/p594sp.pdf
Publication 594 (zh-s),The IRS Collection Process (Chinese-Simplified Version),May 2024,10/25/2024,https://www.irs.gov/pub/irs-pdf/p594zhs.pdf
Publication 594 (zh-t),The IRS Collection Process (Chinese-Traditional Version),May 2024,10/26/2024,https://www.irs.gov/pub/irs-pdf/p594zht.pdf
Publication 595,Capital Construction Fund for Commercial Fishers,Dec 2024,12/06/2024,https://www.irs.gov/pub/irs-pdf/p595.pdf
Publication 596,Earned Income Credit (EIC),2025,12/18/2025,https://www.irs.gov/pub/irs-pdf/p596.pdf
Publication 596 (ko),Earned Income Credit (Korean Version),2025,12/23/2025,https://www.irs.gov/pub/irs-pdf/p596ko.pdf
Publication 596 (ru),Earned Income Credit (Russian Version),2024,02/19/2025,https://www.irs.gov/pub/irs-pdf/p596ru.pdf
Publication 596 (sp),Earned Income Credit (Spanish Version),2024,01/02/2025,https://www.irs.gov/pub/irs-pdf/p596sp.pdf
Publication 596 (vie),Earned Income Credit (Vietnamese Version),2024,01/21/2025,https://www.irs.gov/pub/irs-pdf/p596vie.pdf
Publication 596 (zh-s),Earned Income Credit (Chinese-Simplified Version),2024,01/23/2025,https://www.irs.gov/pub/irs-pdf/p596zhs.pdf
Publication 596 (zh-t),Earned Income Credit (Chinese-Traditional Version),2024,02/12/2025,https://www.irs.gov/pub/irs-pdf/p596zht.pdf
Publication 597,Information on the United States-Canada Income Tax Treaty,Oct 2015,10/07/2015,https://www.irs.gov/pub/irs-pdf/p597.pdf
Publication 598,Tax on Unrelated Business Income of Exempt Organizations,Mar 2021,03/29/2021,https://www.irs.gov/pub/irs-pdf/p598.pdf
Notice 609,Privacy Act Notice,Oct 2013,12/14/2013,https://www.irs.gov/pub/irs-pdf/n609.pdf
Notice 609 (SP),Aviso sobre la Ley de Informacion Confidencial,Oct 2013,05/13/2014,https://www.irs.gov/pub/irs-pdf/n609s.pdf
Form 637,Application for Registration (For Certain Excise Tax Activities),Dec 2022,12/29/2022,https://www.irs.gov/pub/irs-pdf/f637.pdf
Form 656,Offer in Compromise,Apr 2025,04/18/2025,https://www.irs.gov/pub/irs-pdf/f656.pdf
Form 656-B,Form 656 Booklet Offer in Compromise,Apr 2025,04/18/2025,https://www.irs.gov/pub/irs-pdf/f656b.pdf
Form 656-B (sp),Form 656 Booklet Offer in Compromise (Spanish Version),Apr 2025,04/18/2025,https://www.irs.gov/pub/irs-pdf/f656bsp.pdf
Form 656-L,Offer in Compromise (Doubt as to Liability),May 2024,05/13/2024,https://www.irs.gov/pub/irs-pdf/f656l.pdf
Form 656-L (sp),Offer in Compromise (Doubt as to Liability) (Spanish Version),May 2024,08/07/2024,https://www.irs.gov/pub/irs-pdf/f656lsp.pdf
Form 656-PPV,Offer in Compromise - Periodic Payment Voucher,Apr 2020,05/11/2020,https://www.irs.gov/pub/irs-pdf/f656ppv.pdf
Form 656 (sp),Offer in Compromise (Spanish Version),Apr 2025,04/18/2025,https://www.irs.gov/pub/irs-pdf/f656sp.pdf
Form 673,Statement for Claiming Exemption from Withholding on Foreign Earned Income Eligible for the Exclusion(s) Provided by Section 911,Aug 2019,08/28/2019,https://www.irs.gov/pub/irs-pdf/f673.pdf
Notice 703,Read This To See If Your Social Security Benefits May Be Taxable,Nov 2025,11/14/2025,https://www.irs.gov/pub/irs-pdf/n703.pdf
Form 706,United States Estate (and Generation-Skipping Transfer) Tax Return,Aug 2025,09/04/2025,https://www.irs.gov/pub/irs-pdf/f706.pdf
Instruction 706,"Instructions for Form 706, United States Estate (and Generation-Skipping Transfer) Tax Return",Sep 2025,09/29/2025,https://www.irs.gov/pub/irs-pdf/i706.pdf
Form 706-A,United States Additional Estate Tax Return,Aug 2025,09/04/2025,https://www.irs.gov/pub/irs-pdf/f706a.pdf
Instruction 706-A,"Instructions for Form 706-A, United States Additional Estate Tax Return",Sep 2025,09/10/2025,https://www.irs.gov/pub/irs-pdf/i706a.pdf
Form 706-CE,Certification of Payment of Foreign Death Tax,Aug 2025,09/05/2025,https://www.irs.gov/pub/irs-pdf/f706ce.pdf
Form 706-GS(D),Generation-Skipping Transfer Tax Return for Distributions,Dec 2025,11/21/2025,https://www.irs.gov/pub/irs-pdf/f706gsd.pdf
Instruction 706-GS(D),"Instructions for Form 706-GSD, Generation-Skipping Transfer Tax Return for Distributions",Dec 2025,11/21/2025,https://www.irs.gov/pub/irs-pdf/i706gsd.pdf
Form 706-GS(D-1),Notification of Distribution From a Generation-Skipping Trust,Dec 2025,11/18/2025,https://www.irs.gov/pub/irs-pdf/f706gsd1.pdf
Instruction 706-GS(D-1),"Instructions for Form 706-GS(D-1), Notification of Distribution From a Generation-Skipping Trust",Dec 2025,11/18/2025,https://www.irs.gov/pub/irs-pdf/i706gsd1.pdf
Form 706-GS(T),Generation-Skipping Transfer Tax Return For Terminations,Dec 2025,11/18/2025,https://www.irs.gov/pub/irs-pdf/f706gst.pdf
Instruction 706-GS(T),"Instructions for Form 706-GS(T), Generation-Skipping Transfer Tax Return for Terminations",Dec 2025,11/14/2025,https://www.irs.gov/pub/irs-pdf/i706gst.pdf
Form 706-NA,United States Estate (and Generation-Skipping Transfer) Tax Return Estate of Nonresident Not a Citizen of the United States,Aug 2025,09/03/2025,https://www.irs.gov/pub/irs-pdf/f706na.pdf
Instruction 706-NA,"Instructions for Form 706-NA, United States Estate (and Generation-Skipping Transfer) Tax Return Estate of nonresident not a citizen of the United States",Sep 2025,09/29/2025,https://www.irs.gov/pub/irs-pdf/i706na.pdf
Form 706-QDT,U.S. Estate Tax Return for Qualified Domestic Trusts,Aug 2025,09/05/2025,https://www.irs.gov/pub/irs-pdf/f706qdt.pdf
Instruction 706-QDT,"Instructions for Form 706-QDT, U.S. Estate Tax Return for Qualified Domestic Trusts",Aug 2025,09/10/2025,https://www.irs.gov/pub/irs-pdf/i706qdt.pdf
Form 706 (Schedule A),Real Estate,Aug 2025,08/27/2025,https://www.irs.gov/pub/irs-pdf/f706sa.pdf
Form 706 (Schedule B),Stocks and Bonds,Aug 2025,08/27/2025,https://www.irs.gov/pub/irs-pdf/f706sb.pdf
Form 706 (Schedule C),"Mortgages, Notes, and Cash",Aug 2025,08/29/2025,https://www.irs.gov/pub/irs-pdf/f706sc.pdf
Form 706 (Schedule D),Insurance on the Decedent's Life,Aug 2025,08/27/2025,https://www.irs.gov/pub/irs-pdf/f706sd.pdf
Form 706 (Schedule E),Jointly Owned Property,Aug 2025,08/27/2025,https://www.irs.gov/pub/irs-pdf/f706se.pdf
Form 706 (Schedule F),Other Miscellaneous Property Not Reportable Under Any Other Schedule,Aug 2025,08/27/2025,https://www.irs.gov/pub/irs-pdf/f706sf.pdf
Form 706 (Schedule G),Transfers During the Decedent's Lifetime,Aug 2025,08/27/2025,https://www.irs.gov/pub/irs-pdf/f706sg.pdf
Form 706 (Schedule H),Powers of Appointment,Aug 2025,08/27/2025,https://www.irs.gov/pub/irs-pdf/f706sh.pdf
Form 706 (Schedule I),Annuities,Aug 2025,08/27/2025,https://www.irs.gov/pub/irs-pdf/f706si.pdf
Form 706 (Schedule J),Funeral Expenses and Expenses Incurred In Administering Property Subject to Claims,Aug 2025,08/27/2025,https://www.irs.gov/pub/irs-pdf/f706sj.pdf
Form 706 (Schedule K),"Debts, Mortgages, and Liens",Aug 2025,08/27/2025,https://www.irs.gov/pub/irs-pdf/f706sk.pdf
Form 706 (Schedule L),Net Losses During Administration and Expenses Incurred In Administering Property Not Subject to Claims,Aug 2025,08/27/2025,https://www.irs.gov/pub/irs-pdf/f706sl.pdf
Form 706 (Schedule M),"Bequests, etc., to Surviving Spouse",Aug 2025,08/27/2025,https://www.irs.gov/pub/irs-pdf/f706sm.pdf
Form 706 (Schedule O),"Charitable, Public, and Similar Gifts and Bequests",Aug 2025,08/27/2025,https://www.irs.gov/pub/irs-pdf/f706so.pdf
Form 706 (Schedule P),Credit for Certain Foreign Taxes,Aug 2025,08/27/2025,https://www.irs.gov/pub/irs-pdf/f706scp.pdf
Form 706 (Schedule PC),Protective Claim for Refund,Aug 2025,08/29/2025,https://www.irs.gov/pub/irs-pdf/f706spc.pdf
Form 706 (Schedule Q),Credit for Tax on Prior Transfers,Aug 2025,08/27/2025,https://www.irs.gov/pub/irs-pdf/f706sq.pdf
Form 706 (Schedule R),Generation-Skipping Transfer Tax,Aug 2025,08/29/2025,https://www.irs.gov/pub/irs-pdf/f706sr.pdf
Form 706 (Schedule R-1),Generating-Skipping Transfer Tax,Aug 2025,09/05/2025,https://www.irs.gov/pub/irs-pdf/f706sr1.pdf
Form 706 (Schedule T),Section 2032A Property Valuation,Aug 2025,08/29/2025,https://www.irs.gov/pub/irs-pdf/f706st.pdf
Form 706 (Schedule U),Qualified Conservation Easement Exclusion,Aug 2025,08/29/2025,https://www.irs.gov/pub/irs-pdf/f706su.pdf
Form 706 (Schedule W),Continuation Schedule for Form 706 Schedules,Aug 2025,08/29/2025,https://www.irs.gov/pub/irs-pdf/f706sw.pdf
Form 709,United States Gift (and Generation-Skipping Transfer) Tax Return,2024,01/02/2025,https://www.irs.gov/pub/irs-pdf/f709.pdf
Instruction 709,"Instructions for Form 709, United States Gift (and Generation - Skipping Transfer) Tax Return",2025,11/14/2025,https://www.irs.gov/pub/irs-pdf/i709.pdf
Form 709-NA,United States Gift (and Generation-Skipping Transfer) Tax Return of Nonresident Not a Citizen of the United States,2024,04/14/2025,https://www.irs.gov/pub/irs-pdf/f709na.pdf
Instruction 709-NA,"Instructions for Form 709-NA, United States Gift (and Generation-Skipping Transfer) Tax Return of nonresident not a citizen of the United States",2024,05/23/2025,https://www.irs.gov/pub/irs-pdf/i709na.pdf
