Product Number,Title,Revision Date,Posted Date,PDF Link
Publication 1179,"General Rules and Specifications for Substitute Forms 1096, 1098, 1099, 5498, and Certain Other Information Returns",Jul 2025,07/24/2025,https://www.irs.gov/pub/irs-pdf/p1179.pdf
Publication 1187,"Specifications for Electronic Filing of Form 1042-S, Foreign Person's U.S. Source Income Subject to Withholding",Sep 2025,09/17/2025,https://www.irs.gov/pub/irs-pdf/p1187.pdf
Publication 1212,Guide to Original Issue Discount (OID) Instruments,Jan 2025,01/27/2025,https://www.irs.gov/pub/irs-pdf/p1212.pdf
Notice 1214,Helpful Contacts for Your Notice of Deficiency,Oct 2019,05/13/2020,https://www.irs.gov/pub/irs-pdf/n1214.pdf
Notice 1214 (sp),Helpful Contacts for Your Notice of Deficiency (Spanish Version),Oct 2019,06/28/2022,https://www.irs.gov/pub/irs-pdf/n1214sp.pdf
Notice 1215,What to do If You Disagree with the Penalty,Nov 2006,07/17/2012,https://www.irs.gov/pub/irs-pdf/n1215.pdf
Publication 1220,"Specifications for Electronic Filing of Forms 1097, 1098, 1099, 3921, 3922, 5498, and W-2G",Sep 2025,09/23/2025,https://www.irs.gov/pub/irs-pdf/p1220.pdf
Publication 1223,General Rules and Specifications For Substitute Forms W-2c and W-3c,Oct 2024,10/07/2024,https://www.irs.gov/pub/irs-pdf/p1223.pdf
Publication 1239,"Specifications for Electronic Filing of Form 8027, Employer's Annual Information Return of Tip Income and Allocated Tips",Sep 2025,10/07/2025,https://www.irs.gov/pub/irs-pdf/p1239.pdf
Publication 1281,Backup Withholding for Missing and Incorrect Name/TINs (including instructions for reading tape cartridges and CD/DVD formats),Dec 2023,01/23/2024,https://www.irs.gov/pub/irs-pdf/p1281.pdf
Publication 1304,Statistics of Income Individual Income Tax Returns Complete Report,Jan 2025,04/28/2025,https://www.irs.gov/pub/irs-pdf/p1304.pdf
Form 1310,Statement of Person Claiming Refund Due a Deceased Taxpayer,Oct 2024,10/15/2024,https://www.irs.gov/pub/irs-pdf/f1310.pdf
Publication 1321,Special Instructions for Bona Fide Residents Of Puerto Rico Who Must File A U.S. Individual Income Tax Return (Form 1040 or Form 1040-SR),Oct 2025,10/17/2025,https://www.irs.gov/pub/irs-pdf/p1321.pdf
Publication 1321 (sp),Special Instructions for Bona Fide Residents Of Puerto Rico Who Must File A U.S. Individual Income Tax Return (Form 1040 or Form 1040-SR) (Spanish Version),Oct 2025,09/26/2025,https://www.irs.gov/pub/irs-pdf/p1321sp.pdf
Publication 1335,Backup Withholding Questions and Answers,Apr 2023,04/26/2023,https://www.irs.gov/pub/irs-pdf/p1335.pdf
Publication 1335 (SP),Underreporter Backup Withholding Questions and Answers (Spanish Version),Mar 2018,07/26/2022,https://www.irs.gov/pub/irs-pdf/p1335sp.pdf
Publication 1345,Authorized IRS e-file Providers of Individual Income Tax Returns,Oct 2024,10/29/2024,https://www.irs.gov/pub/irs-pdf/p1345.pdf
Publication 1345 (sp),Handbook for Authorized IRS e-file Providers of Individual Income Tax Returns (Spanish Version),Nov 2022,05/25/2023,https://www.irs.gov/pub/irs-pdf/p1345sp.pdf
Form 1363,Export Exemption Certificate,Aug 2021,10/08/2021,https://www.irs.gov/pub/irs-pdf/f1363.pdf
Notice 1392,Supplemental Form W-4 Instructions for Nonresident Aliens,Jan 2020,01/15/2020,https://www.irs.gov/pub/irs-pdf/n1392.pdf
Publication 1415,Federal Tax Compliance Research: Tax Gap Estimates,Oct 2022,10/28/2022,https://www.irs.gov/pub/irs-pdf/p1415.pdf
Notice 1421,How Bankruptcy Affects Your Rights to File a Petition in Tax Court in Response to a Notice of Deficiency,Jan 2012,03/30/2021,https://www.irs.gov/pub/irs-pdf/n1421.pdf
Publication 1436,Assurance Testing System (ATS) Guidelines for Modernized e-File (MeF) Individual Tax Returns,Oct 2025,09/29/2025,https://www.irs.gov/pub/irs-pdf/p1436.pdf
Notice 1444-A (EN-SP),EIP Non-Filers Outreach You May Need to Act to Claim Your Payment,Sep 2020,09/03/2020,https://www.irs.gov/pub/irs-pdf/n1444aes.pdf
Notice 1444-B (EN-SP),Your Second Economic Payment (English/Spanish),Jan 2021,02/11/2021,https://www.irs.gov/pub/irs-pdf/n1444bes.pdf
Publication 1450,Instructions for Requesting a Certificate of Release of Federal Tax Lien,Jul 2018,02/26/2020,https://www.irs.gov/pub/irs-pdf/p1450.pdf
Publication 1450 (SP),Instructions for Requesting a Certificate of Release of Federal Tax Lien (Spanish version),Jul 2018,09/12/2022,https://www.irs.gov/pub/irs-pdf/p1450sp.pdf
Publication 1457,Actuarial Valuations Version 4A,Jun 2023,06/26/2023,https://www.irs.gov/pub/irs-pdf/p1457.pdf
Publication 1458,Actuarial Valuations Version 4B,Jun 2023,06/26/2023,https://www.irs.gov/pub/irs-pdf/p1458.pdf
Notice 1459,"Explanation of Unpaid, Deferred Social Security Taxes Reported by Third-Party Payers (TPPs)",May 2025,06/05/2025,https://www.irs.gov/pub/irs-pdf/n1459.pdf
Publication 1459,Actuarial Valuations Version 4C,Jun 2023,06/26/2023,https://www.irs.gov/pub/irs-pdf/p1459.pdf
Publication 1468,Guidelines for Notices of Federal Tax Liens and Centralized Lien Processing,Jan 2014,01/14/2014,https://www.irs.gov/pub/irs-pdf/p1468.pdf
Publication 1474,Technical Specifications Guide For Reporting Agent Authorization and Federal Tax Depositors,Jun 2025,07/22/2025,https://www.irs.gov/pub/irs-pdf/p1474.pdf
Publication 1494,"Tables for Figuring Amount Exempt from Levy on Wages, Salary, and Other Income (Forms 668-W(ACS) and 668-W(ICS))",Dec 2025,12/15/2025,https://www.irs.gov/pub/irs-pdf/p1494.pdf
Publication 1500,The IRS Research Bulletin,Jun 2025,06/04/2025,https://www.irs.gov/pub/irs-pdf/p1500.pdf
Publication 1516,"Specifications for Electronic Filing of Forms 8596, Information Returns for Federal Contracts",Dec 2025,12/22/2025,https://www.irs.gov/pub/irs-pdf/p1516.pdf
Publication 1518-A,Tax Calendar Options for Businesses and Self-Employed,Dec 2018,04/23/2019,https://www.irs.gov/pub/irs-pdf/p1518a.pdf
Publication 1518-A (SP),Online Tax Calendar in Spanish,Dec 2018,04/23/2019,https://www.irs.gov/pub/irs-pdf/p1518asp.pdf
Publication 1544,"Reporting Cash Payments of Over $10,000",Sep 2014,09/12/2014,https://www.irs.gov/pub/irs-pdf/p1544.pdf
Publication 1544 (SP),"Informe de Pagos en Efectivo en Exceso de $10,000 (Recibidos en Una Ocupacion o Negocio)",Sep 2014,04/08/2015,https://www.irs.gov/pub/irs-pdf/p1544sp.pdf
Publication 1546,The Taxpayer Advocate Service Is Your Voice at the IRS,Jun 2022,07/11/2022,https://www.irs.gov/pub/irs-pdf/p1546.pdf
Publication 1546-EZ,The Taxpayer Advocate Service Is Your Voice at the IRS,Jun 2022,07/11/2022,https://www.irs.gov/pub/irs-pdf/p1546ez.pdf
Publication 1546-EZ (ht),The Taxpayer Advocate Service Is Your Voice at the IRS (Haitian Creole Version),Jan 2017,01/17/2025,https://www.irs.gov/pub/irs-pdf/p1546ezh.pdf
Publication 1546-EZ (ko),The Taxpayer Advocate Service Is Your Voice at the IRS (Korean Version),Jan 2017,01/17/2025,https://www.irs.gov/pub/irs-pdf/p1546ezk.pdf
Publication 1546-EZ (ru),The Taxpayer Advocate Service Is Your Voice at the IRS (Russian Version),Dec 2016,01/17/2025,https://www.irs.gov/pub/irs-pdf/p1546ezr.pdf
Publication 1546-EZ (so),The Taxpayer Advocate Service Is Your Voice at the IRS (Somali Version),Jan 2017,01/17/2025,https://www.irs.gov/pub/irs-pdf/p1546ezs.pdf
Publication 1546-EZ (sp),The Taxpayer Advocate Service Is Your Voice at the IRS (Spanish Version),Jun 2022,01/16/2025,https://www.irs.gov/pub/irs-pdf/p1546esp.pdf
Publication 1546-EZ (vie),The Taxpayer Advocate Service Is Your Voice at the IRS (Vietnamese Version),Jan 2017,01/16/2025,https://www.irs.gov/pub/irs-pdf/p1546ezv.pdf
Publication 1546-EZ (zh-t),The Taxpayer Advocate Service Is Your Voice at the IRS (Chinese-Traditional Version),Apr 2023,01/17/2025,https://www.irs.gov/pub/irs-pdf/p1546ezc.pdf
Publication 1577,Applying for Educational Financial Aid,Oct 2024,12/20/2024,https://www.irs.gov/pub/irs-pdf/p1577.pdf
Publication 1586,Reasonable Cause Regulations and Requirements for Missing and Incorrect Name/TINs on Information Returns (including instructions for reading CD/DVDs),Jul 2023,07/07/2023,https://www.irs.gov/pub/irs-pdf/p1586.pdf
Publication 1586 (sp),Reasonable Cause Regulations and Requirements for Missing and Incorrect Name/TINs on Information Returns (including instructions for reading CD/DVDs) (Spanish Version),Jul 2023,01/30/2024,https://www.irs.gov/pub/irs-pdf/p1586sp.pdf
Publication 1635,Understanding Your EIN,Feb 2014,07/15/2020,https://www.irs.gov/pub/irs-pdf/p1635.pdf
Publication 1660,Collection Appeal Rights,Jan 2020,01/16/2020,https://www.irs.gov/pub/irs-pdf/p1660.pdf
Publication 1660 (SP),Collection Appeal Rights (Spanish version),Feb 2020,02/26/2020,https://www.irs.gov/pub/irs-pdf/p1660sp.pdf
Publication 1769 (EN-SP),IRS Bookmark (English & Spanish),Apr 2021,04/14/2021,https://www.irs.gov/pub/irs-pdf/p1769esp.pdf
Publication 1771,Charitable Contributions - Substantiation and Disclosure Requirements,Nov 2023,12/06/2023,https://www.irs.gov/pub/irs-pdf/p1771.pdf
Publication 1779,Independent Contractor or Employee,Mar 2023,03/22/2023,https://www.irs.gov/pub/irs-pdf/p1779.pdf
Publication 1779 (SP),Independent Contractor or Employee (Spanish Version),Mar 2023,03/23/2023,https://www.irs.gov/pub/irs-pdf/p1779sp.pdf
Publication 1819,"LifeCycle: Divorce and non-custodial, separated, or never married parents",Aug 2024,09/12/2024,https://www.irs.gov/pub/irs-pdf/p1819.pdf
Publication 1828,Tax Guide for Churches and Religious Organizations,Aug 2015,08/27/2015,https://www.irs.gov/pub/irs-pdf/p1828.pdf
Publication 1854,How to Prepare a Collection Information Statement (Form 433-A),Apr 2025,04/29/2025,https://www.irs.gov/pub/irs-pdf/p1854.pdf
Publication 1854 (sp),How to prepare a Collection Information Statement (Form 433-A) (Spanish Version),Apr 2024,07/17/2024,https://www.irs.gov/pub/irs-pdf/p1854sp.pdf
Publication 1915,Understanding Your IRS Individual Taxpayer Identification Number (ITIN),Dec 2024,12/20/2024,https://www.irs.gov/pub/irs-pdf/p1915.pdf
Publication 1915 (sp),Understanding Your IRS Individual Taxpayer Identification Number (ITIN) (Spanish Version),Mar 2022,03/23/2022,https://www.irs.gov/pub/irs-pdf/p1915sp.pdf
Publication 1976,Do you Qualify for Relief under Section 530?,Dec 2025,12/19/2025,https://www.irs.gov/pub/irs-pdf/p1976.pdf
Form 2032,Contract Coverage Under Title II of the Social Security Act,Nov 2024,11/19/2024,https://www.irs.gov/pub/irs-pdf/f2032.pdf
Publication 2043,IRS Refund Information Guidelines for the Tax Preparation Community,Jan 2021,02/19/2021,https://www.irs.gov/pub/irs-pdf/p2043.pdf
Form 2063,U.S. Departing Alien Income Tax Statement,Sep 2024,09/16/2024,https://www.irs.gov/pub/irs-pdf/f2063.pdf
Publication 2104,National Taxpayer Advocate's Annual Report to Congress,Dec 2023,03/28/2025,https://www.irs.gov/pub/irs-pdf/p2104.pdf
Publication 2104-B,National Taxpayer Advocate Annual Report to Congress: Research Reports,Jan 2024,02/01/2024,https://www.irs.gov/pub/irs-pdf/p2104b.pdf
Publication 2104-C,National Taxpayer Advocate Annual Report to Congress Executive Summary,Dec 2023,01/31/2024,https://www.irs.gov/pub/irs-pdf/p2104c.pdf
Publication 2105,Why do I have to Pay Taxes?,May 2023,05/18/2023,https://www.irs.gov/pub/irs-pdf/p2105.pdf
Form 2106,Employee Business Expenses,2025,11/21/2025,https://www.irs.gov/pub/irs-pdf/f2106.pdf
Instruction 2106,"Instructions for Form 2106, Employee Business Expenses",2025,11/21/2025,https://www.irs.gov/pub/irs-pdf/i2106.pdf
Publication 2108,Federal Agency TIN Matching Program,Nov 2024,12/05/2024,https://www.irs.gov/pub/irs-pdf/p2108.pdf
Form 2120,Multiple Support Declaration,Oct 2018,10/10/2018,https://www.irs.gov/pub/irs-pdf/f2120.pdf
Form 2159,Payroll Deduction Agreement,Jul 2024,07/01/2024,https://www.irs.gov/pub/irs-pdf/f2159.pdf
Form 2159 (sp),Payroll Deduction Agreement (Spanish version),Jul 2024,08/29/2024,https://www.irs.gov/pub/irs-pdf/f2159sp.pdf
Form 2210,"Underpayment of Estimated Tax by Individuals, Estates and Trusts",2024,12/31/2024,https://www.irs.gov/pub/irs-pdf/f2210.pdf
Instruction 2210,"Instructions for Form 2210, Underpayment of Estimated Tax by Individuals, Estates, and Trusts",2024,12/30/2024,https://www.irs.gov/pub/irs-pdf/i2210.pdf
Form 2210-F,Underpayment of Estimated Tax By Farmers and Fishers,2024,01/13/2025,https://www.irs.gov/pub/irs-pdf/f2210f.pdf
Instruction 2210-F,"Instructions for Form 2210-F, Underpayment of Estimated Tax by Farmers and Fishers",2024,12/31/2024,https://www.irs.gov/pub/irs-pdf/i2210f.pdf
Form 2220,Underpayment of Estimated Tax by Corporations,2025,12/11/2025,https://www.irs.gov/pub/irs-pdf/f2220.pdf
Instruction 2220,"Instructions for Form 2220, Underpayment of Estimated Tax by Corporations",2025,12/04/2025,https://www.irs.gov/pub/irs-pdf/i2220.pdf
Form 2290,Heavy Highway Vehicle Use Tax Return,Jul 2025,06/16/2025,https://www.irs.gov/pub/irs-pdf/f2290.pdf
Instruction 2290,"Instructions for Form 2290, Heavy Highway Vehicle Use Tax Return",Jul 2025,06/16/2025,https://www.irs.gov/pub/irs-pdf/i2290.pdf
Form 2290 (sp),Heavy Highway Vehicle Use Tax Return (Spanish Version),Jul 2025,06/16/2025,https://www.irs.gov/pub/irs-pdf/f2290sp.pdf
Instruction 2290 (sp),"Instructions for Form 2290, Heavy Highway Vehicle Use Tax Return (Spanish Version)",Jul 2025,06/16/2025,https://www.irs.gov/pub/irs-pdf/i2290sp.pdf
Form 2350,Application for Extension of Time to File U.S. Income Tax Return,2025,11/28/2025,https://www.irs.gov/pub/irs-pdf/f2350.pdf
Form 2350 (sp),Application for Extension of Time to File U.S. Income Tax Return (Spanish Version),2025,12/08/2025,https://www.irs.gov/pub/irs-pdf/f2350sp.pdf
Form 2438,Undistributed Capital Gains Tax Return,Dec 2020,11/30/2020,https://www.irs.gov/pub/irs-pdf/f2438.pdf
Form 2439,Notice to Shareholder of Undistributed Long-Term Capital Gains,Nov 2021,11/29/2021,https://www.irs.gov/pub/irs-pdf/f2439.pdf
Form 2441,Child and Dependent Care Expenses,2025,12/16/2025,https://www.irs.gov/pub/irs-pdf/f2441.pdf
Instruction 2441,"Instructions for Form 2441, Child and Dependent Care Expenses",2025,12/16/2025,https://www.irs.gov/pub/irs-pdf/i2441.pdf
Form 2553,Election by a Small Business Corporation,Dec 2017,01/13/2025,https://www.irs.gov/pub/irs-pdf/f2553.pdf
Instruction 2553,"Instructions for Form 2553, Election by a Small Business Corporation",Dec 2020,12/08/2020,https://www.irs.gov/pub/irs-pdf/i2553.pdf
Form 2555,Foreign Earned Income,2025,10/31/2025,https://www.irs.gov/pub/irs-pdf/f2555.pdf
Instruction 2555,"Instructions for Form 2555, Foreign Earned Income",2025,10/31/2025,https://www.irs.gov/pub/irs-pdf/i2555.pdf
Form 2587,Application for Special Enrollment Examination,Mar 2024,02/29/2024,https://www.irs.gov/pub/irs-pdf/f2587.pdf
Form 2624,Consent for Third Party Contact,Nov 2017,11/09/2017,https://www.irs.gov/pub/irs-pdf/f2624.pdf
Form 2678,Employer/Payer Appointment of Agent,Dec 2024,12/17/2024,https://www.irs.gov/pub/irs-pdf/f2678.pdf
Instruction 2678,"Instructions for Form 2678, Employer/Payer Appointment of Agent",Dec 2024,12/18/2024,https://www.irs.gov/pub/irs-pdf/i2678.pdf
Form 2848,Power of Attorney and Declaration of Representative,Jan 2021,01/23/2021,https://www.irs.gov/pub/irs-pdf/f2848.pdf
Instruction 2848,"Instructions for Form 2848, Power of Attorney and Declaration of Representative",Sep 2021,09/02/2021,https://www.irs.gov/pub/irs-pdf/i2848.pdf
Form 2848 (SP),Power of Attorney and Declaration of Representative (Spanish Version),Jan 2021,03/11/2021,https://www.irs.gov/pub/irs-pdf/f2848sp.pdf
Instruction 2848 (SP),"Instructions for Form 2848 (SP), Power of Attorney and Declaration of Representative (Spanish Version)",Sep 2021,09/15/2021,https://www.irs.gov/pub/irs-pdf/i2848sp.pdf
Publication 3066,Have you Had your Check up this year for Retirement Plans?,Dec 2017,01/18/2018,https://www.irs.gov/pub/irs-pdf/p3066.pdf
Publication 3067,IRS Disaster Assistance - Federally Declared Disaster Area,Jul 2023,07/19/2023,https://www.irs.gov/pub/irs-pdf/p3067.pdf
Publication 3067 (de),IRS Disaster Assistance - Federally Declared Disaster Area (German Version),Jul 2023,10/05/2023,https://www.irs.gov/pub/irs-pdf/p3067de.pdf
Publication 3067 (en-sp),IRS Disaster Assistance - Federally Declared Disaster Area (English/Spanish Version),Jul 2023,08/16/2023,https://www.irs.gov/pub/irs-pdf/p3067esp.pdf
Publication 3067 (ht),IRS Disaster Assistance - Federally Declared Disaster Area (Haitian Creole Version),Jul 2023,10/05/2023,https://www.irs.gov/pub/irs-pdf/p3067ht.pdf
Publication 3067 (ko),IRS Disaster Assistance - Federally Declared Disaster Area (Korean Version),Jul 2023,08/16/2023,https://www.irs.gov/pub/irs-pdf/p3067ko.pdf
Publication 3067 (ru),IRS Disaster Assistance - Federally Declared Disaster Area (Russian Version),Jul 2023,08/16/2023,https://www.irs.gov/pub/irs-pdf/p3067ru.pdf
Publication 3067 (vie),IRS Disaster Assistance - Federally Declared Disaster Area (Vietnamese Version),Jul 2023,10/05/2023,https://www.irs.gov/pub/irs-pdf/p3067vie.pdf
Publication 3067 (zh-s),IRS Disaster Assistance - Federally Declared Disaster Area (Chinese-Simplified Version),Jul 2023,08/16/2023,https://www.irs.gov/pub/irs-pdf/p3067zhs.pdf
Publication 3079,Tax-Exempt Organizations and Gaming,Oct 2018,05/30/2019,https://www.irs.gov/pub/irs-pdf/p3079.pdf
Publication 3112,IRS E-File Application & Participation,Nov 2025,12/16/2025,https://www.irs.gov/pub/irs-pdf/p3112.pdf
Publication 3112 (SP),IRS E-File Application and Participation (Spanish Version),Oct 2022,03/16/2023,https://www.irs.gov/pub/irs-pdf/p3112sp.pdf
Publication 3114,Compliance Checks,Apr 2011,07/17/2012,https://www.irs.gov/pub/irs-pdf/p3114.pdf
Form 3115,Application for Change in Accounting Method,Dec 2022,02/07/2023,https://www.irs.gov/pub/irs-pdf/f3115.pdf
Instruction 3115,"Instructions for Form 3115, Application for Change in Accounting Method",Dec 2022,02/09/2023,https://www.irs.gov/pub/irs-pdf/i3115.pdf
Publication 3125,An Important Message For Taxpayers With IRAs - The IRS Does Not Approve IRA Investments,Sep 2017,09/25/2017,https://www.irs.gov/pub/irs-pdf/p3125.pdf
Publication 3144,Tips on Tips - A Guide to Tip Income Reporting for Employers in Businesses Where Tip Income is Customary,Nov 2021,01/05/2022,https://www.irs.gov/pub/irs-pdf/p3144.pdf
Publication 3148,Tips on Tips - A Guide to Tip Income Reporting for Employees Who Receive Tip Income,Dec 2021,03/10/2022,https://www.irs.gov/pub/irs-pdf/p3148.pdf
Publication 3148 (SP),Tips on Tips - A Guide to Tip Income Reporting for Employees Who Receive Tip Income (Spanish version),Apr 2019,05/11/2020,https://www.irs.gov/pub/irs-pdf/p3148sp.pdf
Publication 3151,The ABCs of FTDs: Quick Reference Guide for Understanding Federal Tax Deposits,Nov 2018,05/11/2020,https://www.irs.gov/pub/irs-pdf/p3151.pdf
Publication 3151-A,The ABCs of FTDs: Resource Guide for Understanding Federal Tax Deposits,Sep 2017,09/16/2017,https://www.irs.gov/pub/irs-pdf/p3151a.pdf
Publication 3202,Seized Computer Evidence Recovery  Specialist (SCERS) Training Program for  Foreign Tax Enforcement Officals,Jun 2000,07/17/2012,https://www.irs.gov/pub/irs-pdf/p3202.pdf
Publication 3211,Earned Income Tax Credit (EITC) Q&A,Jan 2025,01/30/2025,https://www.irs.gov/pub/irs-pdf/p3211.pdf
Publication 3211 (CN),Earned Income Tax Credit (EITC) Q&A (Chinese),Feb 2017,02/24/2017,https://www.irs.gov/pub/irs-pdf/p3211cn.pdf
Publication 3211 (EN-SP),Earned Income Tax Credit (EITC) Q&A (English/Spanish),Feb 2018,05/13/2020,https://www.irs.gov/pub/irs-pdf/p3211esp.pdf
Publication 3211 (KR),Earned Income Tax Credit (EITC) Q&A (Korean),Feb 2017,02/24/2017,https://www.irs.gov/pub/irs-pdf/p3211kr.pdf
Publication 3211 (RU),Earned Income Tax Credit (EITC) Q&A (Russian),Feb 2017,02/24/2017,https://www.irs.gov/pub/irs-pdf/p3211ru.pdf
Publication 3211 (sp),Earned Income Tax Credit (EITC) Q&A (Spanish Version),Jan 2025,03/19/2025,https://www.irs.gov/pub/irs-pdf/p3211sp.pdf
Publication 3211 (VN),Earned Income Tax Credit (EITC) Q&A (Vietnamese),Feb 2017,02/24/2017,https://www.irs.gov/pub/irs-pdf/p3211vn.pdf
Publication 3319,Low Income Taxpayer Clinics (LITC) Grant Application Package and Guidelines,May 2025,05/16/2025,https://www.irs.gov/pub/irs-pdf/p3319.pdf
Publication 3366-A,IRS Tax Forms - Photocopies Available Here,Dec 2010,07/17/2012,https://www.irs.gov/pub/irs-pdf/p3366a.pdf
Publication 3373,"Disclosure of Information to Federal, State, and Local Agencies (DIFSLA) Handbook",May 2025,06/18/2025,https://www.irs.gov/pub/irs-pdf/p3373.pdf
Publication 3386,Tax Guide for Veterans' Organizations,Apr 2018,05/01/2018,https://www.irs.gov/pub/irs-pdf/p3386.pdf
Publication 3402,Taxation of Limited Liability Companies,Mar 2020,03/24/2020,https://www.irs.gov/pub/irs-pdf/p3402.pdf
Publication 3415,Electronic Tax Administration (ETA) Advisory Committee Annual Report to Congress,Jun 2025,06/24/2025,https://www.irs.gov/pub/irs-pdf/p3415.pdf
Form 3468,Investment Credit,2024,12/23/2024,https://www.irs.gov/pub/irs-pdf/f3468.pdf
Instruction 3468,"Instructions for Form 3468, Investment Credit",2024,02/28/2025,https://www.irs.gov/pub/irs-pdf/i3468.pdf
Form 3491,Consumer Cooperative Exemption Application,Oct 2023,09/19/2024,https://www.irs.gov/pub/irs-pdf/f3491.pdf
Publication 3498,The Examination Process,May 2025,05/16/2025,https://www.irs.gov/pub/irs-pdf/p3498.pdf
Publication 3498-A,The Examination Process (Audits by Mail),May 2021,05/26/2021,https://www.irs.gov/pub/irs-pdf/p3498a.pdf
Publication 3498-A (SP),The Examination Process (Examinations by Mail) (Spanish version),Feb 2014,05/11/2020,https://www.irs.gov/pub/irs-pdf/p3498asp.pdf
Form 3520,Annual Return To Report Transactions With Foreign Trusts and Receipt of Certain Foreign Gifts,Dec 2023,01/16/2024,https://www.irs.gov/pub/irs-pdf/f3520.pdf
Instruction 3520,"Instructions for Form 3520, Annual Return to Report Transactions With Foreign Trusts and Receipt of Certain Foreign Gifts",Dec 2025,11/24/2025,https://www.irs.gov/pub/irs-pdf/i3520.pdf
Form 3520-A,Annual Information Return of Foreign Trust With a U.S. Owner,Dec 2023,09/19/2024,https://www.irs.gov/pub/irs-pdf/f3520a.pdf
Instruction 3520-A,"Instructions for Form 3520-A, Annual Information Return of Foreign Trust With a U.S. Owner",Dec 2025,11/24/2025,https://www.irs.gov/pub/irs-pdf/i3520a.pdf
Publication 3524,EITC Eligibility Checklist,Jan 2025,01/30/2025,https://www.irs.gov/pub/irs-pdf/p3524.pdf
Publication 3524 (CN),EITC Eligibility Checklist (Chinese version),Aug 2016,08/30/2016,https://www.irs.gov/pub/irs-pdf/p3524cn.pdf
Publication 3524 (KR),EITC Eligibility Checklist (Korean version),Aug 2016,08/30/2016,https://www.irs.gov/pub/irs-pdf/p3524kr.pdf
Publication 3524 (RU),EITC Eligibility Checklist (Russian version),Aug 2016,08/30/2016,https://www.irs.gov/pub/irs-pdf/p3524ru.pdf
Publication 3524 (sp),EITC Eligibility Checklist (Spanish Version),Jan 2025,03/12/2025,https://www.irs.gov/pub/irs-pdf/p3524sp.pdf
Publication 3524 (VN),EITC Eligibility Checklist (Vietnamese version),Aug 2016,01/30/2017,https://www.irs.gov/pub/irs-pdf/p3524vn.pdf
Publication 3535,Does Your Social Security Card look like this?,Jul 2012,08/23/2012,https://www.irs.gov/pub/irs-pdf/p3535.pdf
Publication 3535 (CN),Does Your Social Security Card look like this? (Chinese version),Jul 2012,08/28/2012,https://www.irs.gov/pub/irs-pdf/p3535cn.pdf
Publication 3535 (KR),Does Your Social Security Card look like this? (Korean version),Jul 2012,08/28/2012,https://www.irs.gov/pub/irs-pdf/p3535kr.pdf
Publication 3535 (RU),Does Your Social Security Card look like this? (Russian version),Jul 2012,08/28/2012,https://www.irs.gov/pub/irs-pdf/p3535ru.pdf
Publication 3535 (SP),Does Your Social Security Card look like this? (Spanish version),Jul 2012,05/02/2013,https://www.irs.gov/pub/irs-pdf/p3535sp.pdf
Publication 3535 (VN),Does Your Social Security Card look like this? (Vietnamese version),Jul 2012,08/23/2012,https://www.irs.gov/pub/irs-pdf/p3535vn.pdf
Publication 3536,Motor Fuel Excise Tax EDI Guide,Jul 2024,07/24/2024,https://www.irs.gov/pub/irs-pdf/p3536.pdf
Publication 3561,Organizational Performance Management And  The IRS Balanced Measurement System,Jan 2000,07/17/2012,https://www.irs.gov/pub/irs-pdf/p3561.pdf
Publication 3583,Internal Revenue Service - Criminal Investigation Annual Report 2025,Dec 2025,12/11/2025,https://www.irs.gov/pub/irs-pdf/p3583.pdf
Publication 3598,What You Should Know About The Audit Reconsideration Process,Nov 2023,10/07/2025,https://www.irs.gov/pub/irs-pdf/p3598.pdf
Publication 3605,Fast Track Mediation-A Process for Prompt Resolution of Tax Issues,Mar 2022,08/16/2023,https://www.irs.gov/pub/irs-pdf/p3605.pdf
Publication 3676-A (en-sp),IRS Certified Volunteers Providing Free Tax Preparation (English/Spanish),Oct 2024,11/18/2024,https://www.irs.gov/pub/irs-pdf/p3676a.pdf
Publication 3676-A (vie),IRS Certified Volunteers Providing Free Tax Preparation (Vietnamese Version),Oct 2024,01/22/2025,https://www.irs.gov/pub/irs-pdf/p3676av.pdf
Publication 3676-A (zh-t),IRS Certified Volunteers Providing Free Tax Preparation (Chinese-Traditional Version),Oct 2024,11/18/2024,https://www.irs.gov/pub/irs-pdf/p3676act.pdf
Publication 3676-B (en-sp),IRS Certified Volunteers Providing Free Tax Preparation (English-Spanish),Dec 2024,04/15/2025,https://www.irs.gov/pub/irs-pdf/p3676bsp.pdf
Publication 3744,Inflation Reduction Act Strategic Operating Plan,Apr 2023,04/25/2023,https://www.irs.gov/pub/irs-pdf/p3744.pdf
Publication 3744-A,IRS Strategic Operating Plan Annual Update Supplement,Apr 2024,06/17/2024,https://www.irs.gov/pub/irs-pdf/p3744a.pdf
Publication 3744-B,IRS Strategic Operating Plan Annual Update,Apr 2024,05/02/2024,https://www.irs.gov/pub/irs-pdf/p3744b.pdf
Publication 3753,Want to improve the IRS? Speak Up!,Jun 2025,07/08/2025,https://www.irs.gov/pub/irs-pdf/p3753.pdf
Form 3800,General Business Credit,2024,02/25/2025,https://www.irs.gov/pub/irs-pdf/f3800.pdf
Instruction 3800,"Instructions for Form 3800, General Business Credit",2024,12/19/2024,https://www.irs.gov/pub/irs-pdf/i3800.pdf
Publication 3833,Disaster Relief (Be Part of the Program),Dec 2014,12/15/2014,https://www.irs.gov/pub/irs-pdf/p3833.pdf
